{
  "$schema": "https://json-schema.org/draft/2020-12/schema",
  "$id": "klode-kit/lane_receipt.json",
  "title": "Lane receipt (work/lanes/<lane>.json)",
  "description": "Written by klode_kit.devtools.run_lane (WI-00s). env_fingerprint (R2-12, R3-08, venv addendum V6) carries release_sha and the realpaths of the repository root and of the python that ran the lane; release_check (WI-15b) treats any mismatch with the current values as stale.",
  "type": "object",
  "additionalProperties": false,
  "required": [
    "schema_version",
    "lane",
    "status",
    "bootstrap",
    "tests_discovered",
    "pytest_exit_code",
    "started_at",
    "finished_at",
    "command",
    "env_fingerprint",
    "tags"
  ],
  "properties": {
    "schema_version": {
      "const": 1
    },
    "lane": {
      "enum": [
        "unit",
        "contract_replay",
        "cli_integration",
        "model_integration",
        "host_acceptance"
      ]
    },
    "status": {
      "enum": [
        "PASS",
        "FAIL",
        "BOOTSTRAP"
      ]
    },
    "bootstrap": {
      "type": "boolean"
    },
    "tests_discovered": {
      "type": "integer",
      "minimum": 0
    },
    "tests_failed": {
      "type": "integer",
      "minimum": 0
    },
    "tests_skipped": {
      "type": "integer",
      "minimum": 0
    },
    "pytest_exit_code": {
      "type": "integer"
    },
    "started_at": {
      "type": "string",
      "pattern": "^\\d{4}-\\d{2}-\\d{2}T\\d{2}:\\d{2}:\\d{2}(\\.\\d+)?(Z|[+-]\\d{2}:\\d{2})$"
    },
    "finished_at": {
      "type": "string",
      "pattern": "^\\d{4}-\\d{2}-\\d{2}T\\d{2}:\\d{2}:\\d{2}(\\.\\d+)?(Z|[+-]\\d{2}:\\d{2})$"
    },
    "command": {
      "type": "array",
      "items": {
        "type": "string"
      },
      "minItems": 1
    },
    "env_fingerprint": {
      "type": "object",
      "additionalProperties": false,
      "required": [
        "release_sha",
        "repo_root",
        "python",
        "python_version",
        "platform"
      ],
      "properties": {
        "release_sha": {
          "type": "string",
          "minLength": 1
        },
        "repo_root": {
          "type": "string",
          "pattern": "^/"
        },
        "python": {
          "type": "string",
          "pattern": "^/"
        },
        "python_version": {
          "type": "string",
          "minLength": 1
        },
        "platform": {
          "type": "string",
          "minLength": 1
        },
        "code_tree_sha": {
          "type": "string",
          "minLength": 1
        },
        "lock_sha": {
          "type": "string",
          "pattern": "^[0-9a-f]{64}$"
        },
        "fixtures_sha": {
          "type": "string",
          "pattern": "^[0-9a-f]{64}$"
        },
        "prompt_sha": {
          "type": "string",
          "pattern": "^[0-9a-f]{64}$"
        },
        "schema_sha": {
          "type": "string",
          "pattern": "^[0-9a-f]{64}$"
        },
        "config_sha": {
          "type": "string",
          "pattern": "^[0-9a-f]{64}$"
        },
        "model_actual": {
          "type": [
            "string",
            "null"
          ]
        }
      }
    },
    "tags": {
      "type": "array",
      "items": {
        "type": "string"
      },
      "uniqueItems": true
    }
  },
  "allOf": [
    {
      "if": {
        "required": [
          "status"
        ],
        "properties": {
          "status": {
            "const": "BOOTSTRAP"
          }
        }
      },
      "then": {
        "properties": {
          "bootstrap": {
            "const": true
          },
          "tests_discovered": {
            "const": 0
          }
        }
      }
    },
    {
      "if": {
        "required": [
          "status"
        ],
        "properties": {
          "status": {
            "const": "PASS"
          }
        }
      },
      "then": {
        "properties": {
          "bootstrap": {
            "const": false
          },
          "tests_discovered": {
            "minimum": 1
          }
        }
      }
    }
  ]
}
