{
  "bootstrap": false,
  "command": [
    "/home/ci/klode-kit/.venv/bin/python",
    "-m",
    "pytest",
    "-m",
    "unit"
  ],
  "env_fingerprint": {
    "code_tree_sha": "e5f6a7b8e5f6a7b8e5f6a7b8e5f6a7b8e5f6a7b8+dirty",
    "config_sha": "e5f6a7b8e5f6a7b8e5f6a7b8e5f6a7b8e5f6a7b8e5f6a7b8e5f6a7b8e5f6a7b8",
    "fixtures_sha": "e5f6a7b8e5f6a7b8e5f6a7b8e5f6a7b8e5f6a7b8e5f6a7b8e5f6a7b8e5f6a7b8",
    "lock_sha": "a1b2c3d4a1b2c3d4a1b2c3d4a1b2c3d4a1b2c3d4a1b2c3d4a1b2c3d4a1b2c3d4",
    "model_actual": "claude-opus",
    "platform": "linux-x86_64",
    "prompt_sha": "c9d0e1f2c9d0e1f2c9d0e1f2c9d0e1f2c9d0e1f2c9d0e1f2c9d0e1f2c9d0e1f2",
    "python": "/usr/lib/python3.12/bin/python3.12",
    "python_version": "3.12.14",
    "release_sha": "a1b2c3d4a1b2c3d4a1b2c3d4a1b2c3d4a1b2c3d4",
    "repo_root": "/home/ci/klode-kit",
    "schema_sha": "a1b2c3d4a1b2c3d4a1b2c3d4a1b2c3d4a1b2c3d4a1b2c3d4a1b2c3d4a1b2c3d4"
  },
  "finished_at": "2026-10-22T12:59:13+00:00",
  "lane": "unit",
  "pytest_exit_code": 0,
  "schema_version": 1,
  "started_at": "2026-10-22T12:58:43+00:00",
  "status": "PASS",
  "tags": [
    "not-release"
  ],
  "tests_discovered": 82,
  "tests_failed": 0,
  "tests_skipped": 1
}
